{
  "schemaVersion": 1,
  "package": "design-pair-implementation-execution",
  "canonicalFingerprint": "3abd6ef9cfd7fea06943a2ef025f019ee6b0bb1edb7ba82910fe022a6d9dd434",
  "candidateCommit": "UNCOMMITTED",
  "runtime": {
    "surface": "github-copilot-cli",
    "clientVersion": "1.0.80",
    "apmVersion": "0.26.0"
  },
  "assessments": [
    {
      "distribution": "apm",
      "status": "PASS",
      "evidenceMode": "REUSED",
      "reason": "Canonical fingerprint is unchanged and existing real multi-turn Copilot evidence remains applicable.",
      "evidenceRefs": [
        "apm-packages/design-pair-implementation-execution/tests/manual-model-smoke/results/20260805-copilot-issue69.md"
      ]
    },
    {
      "distribution": "agent-plugin-direct",
      "status": "HOLD",
      "evidenceMode": "NONE",
      "reason": "The Design Pair bundle intentionally does not inline its Adaptive Implementation dependency; direct composition is not yet behavior-qualified.",
      "evidenceRefs": []
    }
  ]
}
