{
  "schemaVersion": 1,
  "package": "goal-context-authoring",
  "canonicalFingerprint": "f5f46e679fbf01ffc5ac3cb1ef7e56ac080f34ef3577af9ca0bf0e38e2fc3f2a",
  "candidateCommit": "0ff5900beb62d8c42226a5cad2779c56747d50c2",
  "runtime": {
    "surface": "github-copilot-cli",
    "clientVersion": "1.0.80",
    "apmVersion": "0.26.0"
  },
  "assessments": [
    {
      "distribution": "apm",
      "status": "PASS",
      "evidenceMode": "LIVE",
      "reason": "A fresh package-root APM install deployed the copilot, codex, and agent-skills projections and preserved the free-form validator contract.",
      "evidenceRefs": [
        "tests/agent-plugins/results/2026-08-23-runtime-qualification.md"
      ]
    },
    {
      "distribution": "agent-plugin-direct",
      "status": "PASS",
      "evidenceMode": "LIVE",
      "reason": "Copilot discovered the direct bundle, invoked the packaged Skill on repo-owned source material, created free-form output, and passed the bundled validator.",
      "evidenceRefs": [
        "tests/agent-plugins/results/2026-08-23-runtime-qualification.md"
      ]
    }
  ]
}
